{
  "schema_version": "staging-runtime-evidence-v1",
  "evidence_class": "STAGING_RUNTIME",
  "production_release": false,
  "environment": "staging",
  "candidate_sha": "b55fd416c2a35cb22b6a5ea0b317a42f068e94b3",
  "deployment_identity": "staging-b55fd416-20260927T0718Z",
  "generated_at": "2026-09-27T07:23:52Z",
  "public_host": "apgic.ru",
  "dns": {
    "authoritative_nameservers": [
      "ns1.timeweb.ru",
      "ns2.timeweb.ru",
      "ns3.timeweb.org",
      "ns4.timeweb.org"
    ],
    "apex_ipv4": "92.51.23.254",
    "www_ipv4": "92.51.23.254",
    "recursive_resolvers_checked": [
      "8.8.8.8",
      "1.1.1.1"
    ]
  },
  "tls": {
    "issuer": "Let's Encrypt YE2",
    "not_before": "2026-09-26T20:48:20Z",
    "not_after": "2026-12-25T20:48:19Z",
    "sans": [
      "apgic.ru",
      "www.apgic.ru"
    ],
    "http_redirect": 301,
    "https_apex_status": 200,
    "https_www_status": 200
  },
  "runtime": {
    "healthz": "ok",
    "readyz": "ready",
    "meta_commit_sha": "b55fd416c2a35cb22b6a5ea0b317a42f068e94b3",
    "watchdog_result": "success",
    "nginx_config_valid": true,
    "worktree_clean": true
  },
  "database": {
    "backup_result": "success",
    "backup_artifact": "/var/backups/apgic/apgic_staging_20260927T070657Z.dump",
    "restore_verification_result": "success",
    "restored_table_count": 57
  },
  "live_e2e": {
    "spec_path": "apps/web/e2e/foundation.spec.ts",
    "base_url": "https://apgic.ru",
    "projects": [
      "phone",
      "tablet",
      "desktop"
    ],
    "tests_total": 12,
    "tests_passed": 12,
    "tests_failed": 0,
    "tested_sha": "b55fd416c2a35cb22b6a5ea0b317a42f068e94b3"
  },
  "supported_requirements": [
    "APGIC-EXEC-001",
    "APGIC-NFR-001",
    "APGIC-TEST-001",
    "APGIC-RELEASE-001",
    "APGIC-UI-001",
    "APGIC-DEMAND-001",
    "APGIC-MATCH-001",
    "APGIC-SEARCH-001",
    "APGIC-BOOK-002",
    "APGIC-PAY-001",
    "APGIC-NOTIF-001",
    "APGIC-CONSULT-001",
    "APGIC-COMM-002",
    "APGIC-CONSULT-002",
    "APGIC-PRIV-001"
  ],
  "limitations": [
    "This is staging runtime evidence and is not production release approval.",
    "APGIC-DR-001 remains unproven because its acceptance requires a scheduled restore drill from a production backup with measured RPO/RTO.",
    "Signed iOS and Android production artifacts, organization-owned store evidence, rollout evidence and production mobile observability remain external blockers tracked by issue #3.",
    "GitHub CI run 659 validated source PR head 5b0ad599f74019149ec5d7736b5561dd2e948e76; deployed merge SHA b55fd416c2a35cb22b6a5ea0b317a42f068e94b3 was then verified by health/readiness, watchdog, DNS/TLS checks and 12/12 live Playwright tests.",
    "Ledger entries are durable in PostgreSQL, but the remaining conformance demand journey state (intent/hold/booking/checkout/session maps) is still process-memory and restart durability for that state is not claimed by this evidence."
  ]
}
